{
  "stage": "SG-014",
  "generated_at": "2026-07-23T00:03:42.029Z",
  "operator": "termux",
  "inputs": [
    "docs/product/FORGE_PRODUCT_SPEC.md",
    "scaffolds/manifest/rewrite-stages.json"
  ],
  "outputs": [
    "scaffolds/artifacts/SG-014/observable-behavior-signal-contract.artifact.json",
    "scaffolds/reports/SG-014-evidence.json"
  ],
  "hashes": {
    "scaffolds/artifacts/SG-014/observable-behavior-signal-contract.artifact.json": "2ec2e0c651589f117f1ba8a1b6def785fedb6c3794cd846ee4020bce841a0b74"
  },
  "validations": [
    "scaffold:validate"
  ],
  "status": "PASS"
}
