{
  "stage": "SG-006",
  "generated_at": "2026-07-23T00:02:50.561Z",
  "operator": "termux",
  "inputs": [
    "docs/product/FORGE_PRODUCT_SPEC.md",
    "scaffolds/manifest/rewrite-stages.json"
  ],
  "outputs": [
    "scaffolds/artifacts/SG-006/product-catalog-contract.artifact.json",
    "scaffolds/reports/SG-006-evidence.json"
  ],
  "hashes": {
    "scaffolds/artifacts/SG-006/product-catalog-contract.artifact.json": "0618066793629a369919c2bea10b5ade15f87ff65a74bf41174f023b90d078e7"
  },
  "validations": [
    "scaffold:validate"
  ],
  "status": "PASS"
}
