{
  "stage": "SG-008",
  "generated_at": "2026-07-22T23:59:32.901Z",
  "operator": "termux",
  "inputs": [
    "docs/product/FORGE_PRODUCT_SPEC.md",
    "scaffolds/manifest/rewrite-stages.json"
  ],
  "outputs": [
    "scaffolds/artifacts/SG-008/carrier-scope-contract.artifact.json",
    "scaffolds/reports/SG-008-evidence.json"
  ],
  "hashes": {
    "scaffolds/artifacts/SG-008/carrier-scope-contract.artifact.json": "e7fcbeea6ffe77d89539f7293e149596f62ec35ef24c4e8d21f01bb6edd44fcc"
  },
  "validations": [
    "scaffold:validate"
  ],
  "status": "PASS"
}
