{
  "stage": "SG-004",
  "generated_at": "2026-07-23T00:04:32.516Z",
  "operator": "termux",
  "inputs": [
    "docs/product/FORGE_PRODUCT_SPEC.md",
    "scaffolds/manifest/rewrite-stages.json"
  ],
  "outputs": [
    "scaffolds/artifacts/SG-004/nashboundary-contract.artifact.json",
    "scaffolds/artifacts/SG-004/conversation-guidance-contract.artifact.json",
    "scaffolds/artifacts/SG-004/nashcontext-contract.artifact.json",
    "scaffolds/reports/SG-004-evidence.json"
  ],
  "hashes": {
    "scaffolds/artifacts/SG-004/nashboundary-contract.artifact.json": "09b2cfaa1abd5123ca34de66342c891fa129a6cd5ab2f89ed5c8b353c5f01fd4",
    "scaffolds/artifacts/SG-004/conversation-guidance-contract.artifact.json": "b0f2620e57eb44eb4873c4713b24c46f8ac617f326ef1fb626dff2b5cc2eb86a",
    "scaffolds/artifacts/SG-004/nashcontext-contract.artifact.json": "e7fea0c6b47ebcb443fb12febccd3959c0a82290c287e3dc3bb36f1a7e67b85a"
  },
  "validations": [
    "scaffold:validate"
  ],
  "status": "PASS"
}
