{
  "stage": "SG-002",
  "generated_at": "2026-07-23T03:51:01.430Z",
  "operator": "root",
  "inputs": [
    "docs/product/FORGE_PRODUCT_SPEC.md",
    "scaffolds/manifest/rewrite-stages.json"
  ],
  "outputs": [
    "platform/core/generated/decision-contract.mjs",
    "platform/actions/generated/action-contract.mjs",
    "platform/read-models/generated/read-only-adapter-contract.mjs",
    "scaffolds/artifacts/SG-002/evidence-envelope.artifact.json",
    "scaffolds/artifacts/SG-002/claim-contract.artifact.json",
    "scaffolds/artifacts/SG-002/provenance-model.artifact.json",
    "scaffolds/artifacts/SG-002/unknown-state-policy.artifact.json",
    "scaffolds/reports/SG-002-evidence.json"
  ],
  "hashes": {
    "platform/core/generated/decision-contract.mjs": "4250c989b72cc908246ea6fc549d9597beae267d7b110a491529a1c52a4df157",
    "platform/actions/generated/action-contract.mjs": "5baa1e7cbfcc55de40b45e6606b38469909e24957291c2c1b7c0d40fd458d7ce",
    "platform/read-models/generated/read-only-adapter-contract.mjs": "2ada36ee67bf95ce3d897fbeb1aaae6ee944592690b5d04a549703f7c5b2ad4a",
    "scaffolds/artifacts/SG-002/evidence-envelope.artifact.json": "a69d6ecf138d0d436fe92f0c3b6a86492bf035b5c00bff5ff737a3acb37d5a64",
    "scaffolds/artifacts/SG-002/claim-contract.artifact.json": "4c8f105950d746cb19e5e26cd7fc3070c3bd66960fd5ae910a283a46772b42b9",
    "scaffolds/artifacts/SG-002/provenance-model.artifact.json": "e00ec394584338ed7761623f5d30aa3125d0b881035cb69028df3c5cd709090a",
    "scaffolds/artifacts/SG-002/unknown-state-policy.artifact.json": "e4b3f5d8d3b0fa99c986ad39d2b1e71a46ef0facd6aa022666858c46c9a588e6"
  },
  "validations": [
    "scaffold:validate"
  ],
  "status": "PASS"
}
