{
  "stage": "SG-009",
  "generated_at": "2026-07-23T00:00:23.163Z",
  "operator": "termux",
  "inputs": [
    "docs/product/FORGE_PRODUCT_SPEC.md",
    "scaffolds/manifest/rewrite-stages.json"
  ],
  "outputs": [
    "scaffolds/artifacts/SG-009/rule-pack-contract.artifact.json",
    "scaffolds/artifacts/SG-009/rule-snapshot-contract.artifact.json",
    "scaffolds/reports/SG-009-evidence.json"
  ],
  "hashes": {
    "scaffolds/artifacts/SG-009/rule-pack-contract.artifact.json": "2229881bee2de8ad1716e96b8cbcc5d09fd20bb05dfff9170e9374d963e1d826",
    "scaffolds/artifacts/SG-009/rule-snapshot-contract.artifact.json": "8c16be7f2613c712e05bff6e9f8b4bfbebb5735ad90ffdfae8216d3cc62a67a7"
  },
  "validations": [
    "scaffold:validate"
  ],
  "status": "PASS"
}
