{
  "stage": "SG-026",
  "generated_at": "2026-07-22T23:58:05.320Z",
  "operator": "termux",
  "inputs": [
    "docs/product/FORGE_PRODUCT_SPEC.md",
    "scaffolds/manifest/rewrite-stages.json"
  ],
  "outputs": [
    "scaffolds/artifacts/SG-026/domain-event-taxonomy.artifact.json",
    "scaffolds/artifacts/SG-026/event-receipt-contract.artifact.json",
    "scaffolds/artifacts/SG-026/rollback-checkpoint-contract.artifact.json",
    "scaffolds/reports/SG-026-evidence.json"
  ],
  "hashes": {
    "scaffolds/artifacts/SG-026/domain-event-taxonomy.artifact.json": "ec386cdae175bb70a61c734f7e90db7906d7f797639b333c31b89d48209f7f0a",
    "scaffolds/artifacts/SG-026/event-receipt-contract.artifact.json": "34dcee770bc972312b4f3903004852b332329372c15422703206ca4042e4f166",
    "scaffolds/artifacts/SG-026/rollback-checkpoint-contract.artifact.json": "e841441ac61d9218f6909d784987c1552b3dafc4e8091180713bccccccc9156d"
  },
  "validations": [
    "scaffold:validate"
  ],
  "status": "PASS"
}
