{
  "stage": "SG-028",
  "generated_at": "2026-07-23T00:17:51.043Z",
  "operator": "termux",
  "inputs": [
    "docs/product/FORGE_PRODUCT_SPEC.md",
    "scaffolds/manifest/rewrite-stages.json"
  ],
  "outputs": [
    "scaffolds/artifacts/SG-028/advisor-workspace-surface-contract.artifact.json",
    "scaffolds/reports/SG-028-evidence.json"
  ],
  "hashes": {
    "scaffolds/artifacts/SG-028/advisor-workspace-surface-contract.artifact.json": "1e5bd7e71bfb39136c60c81f88864d1b18b42d28f73001651636c31ce3160845"
  },
  "validations": [
    "scaffold:validate"
  ],
  "status": "PASS"
}
